{
  "format_scale": "100%",
  "name": "John Cornelius",
  "title": "Training, Standardization & Service Enablement Leader",
  "contact": {
    "location": "Harpers Ferry, WV",
    "email": "corn82@icloud.com",
    "phone": "(304) 268-4985",
    "linkedin": "https://www.linkedin.com/in/john-w-cornelius",
    "github": "https://github.com/corn8200"
  },
  "summary": "Operations and training leader with a manufacturing improvement base and a 20-year Army aviation standardization background. Builds SOP-linked training, evaluation routines, readiness systems, and practical analytics that help teams work safely, consistently, and with less rework. Best positioned for roles where service quality, technical enablement, field readiness, and process discipline matter more than generic customer-service metrics.",
  "skills": {
    "Training & Standardization": [
      "SOP-linked micro-modules and practical exercises",
      "Competency evaluations and qualification routines",
      "Train-the-trainer methods",
      "Aircrew and frontline readiness systems",
      "Standards, accountability, and coaching"
    ],
    "Operations Enablement": [
      "Daily execution cadence",
      "Safety, quality, production, and logistics coordination",
      "Cross-functional stakeholder communication",
      "Service and field-readiness workflows",
      "Change adoption with operators and supervisors"
    ],
    "Analytics & Tools": [
      "Power BI, Python, SQL, MES, ERP, and SCADA data",
      "Power Apps workflow automation",
      "Training and compliance dashboards",
      "AI-assisted document review",
      "Knowledge-transfer systems"
    ],
    "Continuous Improvement": [
      "Lean and Six Sigma methods",
      "Root-cause analysis and standard work",
      "Rapid Improvement Events",
      "Benefits tracking",
      "Green Belt and analyst coaching"
    ]
  },
  "experience": [
    {
      "title": "AI & Six Sigma Lead / Operations & Quality Leader",
      "company": "Major Building Products Manufacturer",
      "location": "Multi-site manufacturing",
      "dates": "Sep 2022 - Present",
      "duties": [
        "Developed courses, SOP-linked micro-modules, practical exercises, and competency evaluations for production, safety, quality, and logistics training.",
        "Built Level 1-3 evaluation instruments and used training data to revise content and improve time-to-qualification.",
        "Train and coach 60+ Green Belts and analysts on structured problem solving, data analysis, practical AI tools, and business-case communication.",
        "Build Power BI and Python analytics workflows for loss analysis, SPC, project tracking, and operational decision support.",
        "Translate technical and analytical work into clear business language for plant managers, functional leaders, and senior stakeholders."
      ],
      "achievements": [
        "Eliminated 15-minute pre-shift handovers by building an automated Power Apps shift brief system, saving $16.8K per year.",
        "Cut JHA review time by 75% using a ChatGPT API workflow with company-specific vector retrieval.",
        "Manage a 40+ project DMAIC and continuous-improvement portfolio tied to $4.2M+ in annualized savings.",
        "Lead and support 30+ Rapid Improvement Events annually, helping teams define problems, test countermeasures, document results, and present business impact."
      ]
    },
    {
      "title": "Army Aviation Standardization & Training Leader (Retired CW3)",
      "company": "U.S. Army Aviation",
      "location": "Multiple locations",
      "dates": "2002 - 2022",
      "duties": [
        "Managed aircrew training and Electronic Flight Bag programs, maintaining current DoD flight information and digital procedures.",
        "Built training, evaluation, standards, and risk-management systems that improved readiness, accountability, and disciplined execution.",
        "Led standardization and operational excellence across multiple organizations through structured evaluation and training programs.",
        "Used post-mission debriefs, root-cause analysis, and standards reviews to improve training throughput, cycle adherence, and operational learning."
      ],
      "achievements": [
        "Designed and executed learning and development programs that progressed 55 pilots to mission-qualified status.",
        "Mentored 25 pilots to pilot-in-command status while conducting standardization evaluations.",
        "Led revision of USAACE Regulation 350-3, consolidating two regulations and streamlining aircraft scheduling.",
        "Completed a 20-year Army career with UH-60/MH-60 aviation, instructor pilot, and operations leadership experience."
      ]
    }
  ],
  "education": [
    {
      "degree": "M.S. - Unmanned Systems, Human Factors Engineering",
      "school": "Embry-Riddle Aeronautical University",
      "details": "GPA 4.0",
      "year": "2020"
    },
    {
      "degree": "B.S. - Aeronautics",
      "school": "Embry-Riddle Aeronautical University",
      "year": "2012"
    }
  ],
  "certifications": [
    { "name": "Lean Six Sigma Green Belt", "issuer": "Lean Methods Group & Simplilearn", "year": "2024" },
    { "name": "Lean Six Sigma Bronze Belt", "issuer": "Lean Methods Group", "year": "2023" },
    { "name": "CS50AI: Artificial Intelligence with Python", "issuer": "Harvard University (edX)", "year": "2025" },
    { "name": "FAA Remote Pilot (Part 107)", "issuer": "Federal Aviation Administration", "year": "2018" },
    { "name": "U.S. Army Instructor Pilot", "issuer": "U.S. Army Aviation", "year": "verified service credential" }
  ],
  "training": [
    "U.S. Army aviation standardization, instructor-pilot, and readiness training"
  ],
  "affiliations": [
    "Civil Air Patrol - sUAS training and community programs",
    "U.S. Army veteran; community volunteer leadership in Eastern Panhandle, WV"
  ],
  "meta": {
    "slug": "director-of-customer-support",
    "version": "1.0.0",
    "title": "Training, Standardization & Service Enablement Leader",
    "aliases": [
      "training-enablement",
      "service-enablement",
      "standardization"
    ],
    "kpis": [
      "55 pilots progressed to mission-qualified status",
      "25 pilots mentored to pilot-in-command",
      "75% JHA review-time reduction",
      "$16.8K workflow savings",
      "60+ Green Belts and analysts coached"
    ]
  }
}
